{
  "concept_summary": "A tiny example concept used as a cross-schema fixture. The player reads a target number and taps counter tiles to accumulate a running total; when the running total equals the target, the player commits. Happy-path illustration of additive composition toward a visible target within 10.",
  "constraints": [
    "running total must be visible at all times"
  ],
  "core_mechanic": {
    "feedback_loop": "The running total is always visible. On a matching commit the target flashes green; on overshoot the running total resets with an amber cue.",
    "player_action": "Tap counter tiles to add their value to a running total, then commit when the running total equals the target."
  },
  "family_candidate": "quantity_and_fulfillment",
  "generated_from": {
    "generator_name": "concept-packet-stub",
    "generator_version": "concept-packet-stub-v0.2.0",
    "manifest_id": "gm_20260410_a1b2c3",
    "request_id": "gr_20260410_a1b2c3"
  },
  "interaction_type_candidate": "combine_and_build",
  "math_domain": "operations_and_algebraic_thinking",
  "misconception_targets": [
    {
      "description": "Player clicks as fast as possible and ignores the running total, assuming any click is progress regardless of the target.",
      "existing_library_match": null,
      "id": "M1"
    }
  ],
  "schema_version": "0.1.0",
  "slug": "example-game",
  "source_brief_id": "cb_20260410_a1b2c3",
  "status": "draft_generated",
  "success_condition": "Player stops tapping when the running total equals the target, not before and not after.",
  "target_learners": {
    "grade_band_candidate": "k_2",
    "prerequisites_candidate": []
  },
  "target_skill": {
    "ccss_candidate": [],
    "description": "Additive composition toward a stated target within 10, demonstrated through deliberate tap-to-accumulate gameplay."
  },
  "title": "Example Game"
}
